{
  "$schema": "https://json-schema.org/draft/2020-12/schema",
  "type": "object",
  "properties": {
    "version": {
      "type": "number",
      "const": 1
    },
    "idempotencyKey": {
      "type": "string",
      "minLength": 1,
      "maxLength": 200,
      "pattern": "^[A-Za-z0-9_:+.@/-]+$"
    },
    "contextId": {
      "type": "string",
      "minLength": 1,
      "maxLength": 200,
      "pattern": "^[A-Za-z0-9_:+.@/-]+$"
    },
    "operation": {
      "type": "string",
      "const": "poll.create"
    },
    "arguments": {
      "type": "object",
      "properties": {
        "space": {
          "type": "object",
          "properties": {
            "version": {
              "type": "number",
              "const": 1
            },
            "id": {
              "type": "string",
              "minLength": 1,
              "maxLength": 200,
              "pattern": "^[A-Za-z0-9_:+.@/-]+$"
            },
            "scope": {
              "type": "object",
              "properties": {
                "projectId": {
                  "type": "string",
                  "minLength": 1,
                  "maxLength": 200,
                  "pattern": "^[A-Za-z0-9_:+.@/-]+$"
                },
                "provider": {
                  "type": "string",
                  "const": "imessage"
                },
                "accountId": {
                  "type": "string",
                  "minLength": 1,
                  "maxLength": 200,
                  "pattern": "^[A-Za-z0-9_:+.@/-]+$"
                },
                "lineId": {
                  "type": "string",
                  "minLength": 1,
                  "maxLength": 200,
                  "pattern": "^[A-Za-z0-9_:+.@/-]+$"
                },
                "spaceId": {
                  "type": "string",
                  "minLength": 1,
                  "maxLength": 200,
                  "pattern": "^[A-Za-z0-9_:+.@/-]+$"
                }
              },
              "required": [
                "projectId",
                "provider",
                "accountId",
                "lineId",
                "spaceId"
              ],
              "additionalProperties": false
            },
            "kind": {
              "type": "string",
              "const": "space"
            }
          },
          "required": [
            "version",
            "id",
            "scope",
            "kind"
          ],
          "additionalProperties": false
        },
        "question": {
          "type": "string",
          "minLength": 1,
          "maxLength": 500
        },
        "options": {
          "minItems": 2,
          "maxItems": 12,
          "type": "array",
          "items": {
            "type": "object",
            "properties": {
              "key": {
                "type": "string",
                "minLength": 1,
                "maxLength": 200,
                "pattern": "^[A-Za-z0-9_:+.@/-]+$"
              },
              "label": {
                "type": "string",
                "minLength": 1,
                "maxLength": 200
              }
            },
            "required": [
              "key",
              "label"
            ],
            "additionalProperties": false
          }
        }
      },
      "required": [
        "space",
        "question",
        "options"
      ],
      "additionalProperties": false
    }
  },
  "required": [
    "version",
    "idempotencyKey",
    "contextId",
    "operation",
    "arguments"
  ],
  "additionalProperties": false
}
