{
  "version": 1,
  "idempotencyKey": "request-poll.create",
  "contextId": "context-1",
  "operation": "poll.create",
  "arguments": {
    "space": {
      "version": 1,
      "id": "space-1",
      "scope": {
        "projectId": "project-1",
        "provider": "imessage",
        "accountId": "account-1",
        "lineId": "line-1",
        "spaceId": "space-1"
      },
      "kind": "space"
    },
    "question": "which?",
    "options": [
      {
        "key": "one",
        "label": "one"
      },
      {
        "key": "two",
        "label": "two"
      }
    ]
  }
}
